{
    "$id": "https://example.com/address.schema.json",
    "$schema": "http://json-schema.org/draft-07/schema#",
    "definitions": {
        "statusDetails": {
            "type": "object",
            "properties": {
                "slack": {
                    "type": "object",
                    "properties": {
                        "emojiName": {
                            "type": "string"
                        }
                    },
                    "required": [
                        "emojiName"
                    ]
                },
                "github": {
                    "type": "object",
                    "properties": {
                        "emojiName": {
                            "type": "string"
                        }
                    },
                    "required": [
                        "emojiName"
                    ]
                },
                "text": {
                    "type": "string"
                },
                "priority": {
                    "type": "number",
                    "minimum": 0
                }
            },
            "required": [
                "slack",
                "github",
                "text",
                "priority"
            ]
        }
    },
    "type": "object",
    "properties": {
        "🚀️": {
            "$ref": "#/definitions/statusDetails"
        },
        "🎯": {
            "$ref": "#/definitions/statusDetails"
        },
        "☕": {
            "$ref": "#/definitions/statusDetails"
        },
        "🗓": {
            "$ref": "#/definitions/statusDetails"
        },
        "🚌": {
            "$ref": "#/definitions/statusDetails"
        },
        "🌴": {
            "$ref": "#/definitions/statusDetails"
        },
        "🏡": {
            "$ref": "#/definitions/statusDetails"
        },
        "🤒": {
            "$ref": "#/definitions/statusDetails"
        }
    },
    "required": [
        "🚀️",
        "🎯",
        "☕",
        "🗓",
        "🚌",
        "🌴",
        "🏡",
        "🤒"
    ],
    "additionalProperties": false
}